{
  "schema_version": 1,
  "manifest_id": "benchmark/families-v1/slice-30-closure",
  "status": "computed_not_sealed",
  "source_revision": "a2dde2b191f6b78c2003d74875560da782470968",
  "language_version": "0.43",
  "tenant_prefix": "examples/play-prod-v2",
  "closure_policy": "whole_program_build_input",
  "leakage_group_id": "sha256:2efe88f1ec36ca151c15a728db8623de4e8a34628ad3aaf60c76ae10ea170c47",
  "distinct_leakage_groups": 1,
  "independence_status": "correlated_single_whole_tenant_group",
  "counts": {
    "tasks_in": 30,
    "tasks_out": 30,
    "task_ids_distinct": 30,
    "sources_in": 201,
    "sources_out": 201,
    "source_paths_distinct": 201,
    "source_blob_oids_distinct": 201,
    "gaps": 0
  },
  "shared_closures": [
    {
      "closure_id": "whole-tenant",
      "status": "computed_not_sealed",
      "leakage_group_id": "sha256:2efe88f1ec36ca151c15a728db8623de4e8a34628ad3aaf60c76ae10ea170c47",
      "reason": "Metis build loads and compiles the complete tenant whole-program",
      "inputs": [
        {
          "path": "examples/play-prod-v2/_tenant.metis",
          "blob_oid": "d38b2f1e53de5231f1d0dfdfccb075b893d5ecc2"
        },
        {
          "path": "examples/play-prod-v2/catalogs/link.metis",
          "blob_oid": "918c7ef3f3215fa834a6b25fe9e65f790a76969d"
        },
        {
          "path": "examples/play-prod-v2/catalogs/smart_index.metis",
          "blob_oid": "053125493a64d16ae175616860b0777a10e29fc5"
        },
        {
          "path": "examples/play-prod-v2/catalogs/trending.metis",
          "blob_oid": "e4b2f7d940cc19b4f7e6656d3ef91d81f26d2286"
        },
        {
          "path": "examples/play-prod-v2/catalogs/user_clusters.metis",
          "blob_oid": "084833c59deb28bea70e679a4e1b65ad2078b3a9"
        },
        {
          "path": "examples/play-prod-v2/catalogs/user_session.metis",
          "blob_oid": "e34e73f7fcaecbe2919ffc5dd06956690c8f7c41"
        },
        {
          "path": "examples/play-prod-v2/catalogs/users.metis",
          "blob_oid": "72a645f3dbc5eba67e0794923edea71e10d1badb"
        },
        {
          "path": "examples/play-prod-v2/catalogs/video.metis",
          "blob_oid": "6c1c200c8297ff4a695854e238554c0882d1c4f7"
        },
        {
          "path": "examples/play-prod-v2/legacy-wire.json",
          "blob_oid": "422e6209514e43bbe786320b80bb0985afa9efad"
        },
        {
          "path": "examples/play-prod-v2/lib/lists.metis",
          "blob_oid": "1156ae317e53003214bf69cb41f8d28bb4ce61b3"
        },
        {
          "path": "examples/play-prod-v2/lib/presets.metis",
          "blob_oid": "348df13b9511473e1a2d755eca222c09cf13eba6"
        },
        {
          "path": "examples/play-prod-v2/lib/presets.migrated.metis",
          "blob_oid": "cbae5ea0b0908f1d5f2c8bd3b7e3750834825719"
        },
        {
          "path": "examples/play-prod-v2/materialized-fallbacks.source.json",
          "blob_oid": "9afb2576a0f15df139b69612a73cc2764a3a104e"
        },
        {
          "path": "examples/play-prod-v2/metis.toml",
          "blob_oid": "47642ed641dcf60f6b64fda604c721f349a582bf"
        },
        {
          "path": "examples/play-prod-v2/names.map.json",
          "blob_oid": "985caca26b87e99cf5c08b1050d884761f3bc77d"
        },
        {
          "path": "examples/play-prod-v2/properties/dem/_property.metis",
          "blob_oid": "0c1173e58bfaceae6620d8a3b8fdaab299bfbec4"
        },
        {
          "path": "examples/play-prod-v2/properties/dem/dem_test.metis",
          "blob_oid": "1b27f647d272affaaa94a16bddf2e09019c7a5b4"
        },
        {
          "path": "examples/play-prod-v2/properties/general/_property.migrated.metis",
          "blob_oid": "c2d42d1e2927f308e56a82a089ffedeba80e32cf"
        },
        {
          "path": "examples/play-prod-v2/properties/general/prod_codice_f_presente.metis",
          "blob_oid": "68fa18739b9cb6896307c73837fa65bb670c191d"
        },
        {
          "path": "examples/play-prod-v2/properties/general/stagioni_da_taggare.metis",
          "blob_oid": "79376b188f9bcd6ec3e1b1f2231e6e118279bb68"
        },
        {
          "path": "examples/play-prod-v2/properties/general/test_endpoint.metis",
          "blob_oid": "4460273f49513d1cab0c32992cebcb9d64d85eb7"
        },
        {
          "path": "examples/play-prod-v2/properties/play/_property.metis",
          "blob_oid": "f04b8fc2cdeb13e75341b559d41cbd6aad92a338"
        },
        {
          "path": "examples/play-prod-v2/properties/play/a_btest_cinema_free.metis",
          "blob_oid": "3c0e2958f17d2a32430e77eba120b01db762c9b6"
        },
        {
          "path": "examples/play-prod-v2/properties/play/article_season_params.metis",
          "blob_oid": "c197b139be9b7023137a3b5234acbdc905547d9e"
        },
        {
          "path": "examples/play-prod-v2/properties/play/because_you_fiction_serie_tv.metis",
          "blob_oid": "5c468082aef07e0140ef6527642d71fbf3b2fef2"
        },
        {
          "path": "examples/play-prod-v2/properties/play/chnls_all_movie_serie.metis",
          "blob_oid": "03ffde13e04ec01f2ef9e380d472f4a8dc11d861"
        },
        {
          "path": "examples/play-prod-v2/properties/play/chnls_all_movies.metis",
          "blob_oid": "c2d988ea1fdfd04077220c4caac05a8e58901228"
        },
        {
          "path": "examples/play-prod-v2/properties/play/chnls_all_series.metis",
          "blob_oid": "578f26eb0dd9762eb7b1044a6b2b16b534a3683c"
        },
        {
          "path": "examples/play-prod-v2/properties/play/chnls_film_in_scadenza.metis",
          "blob_oid": "8b295d3e1bddff6c1ee529ddb10bddcb070776e3"
        },
        {
          "path": "examples/play-prod-v2/properties/play/chnls_film_params_genre.metis",
          "blob_oid": "a30264527163f9d0139eb9a98cf5f0b5f73868ff"
        },
        {
          "path": "examples/play-prod-v2/properties/play/chnls_film_serie_most_recent.metis",
          "blob_oid": "fb4fba22733e20318f4c117a500477d1eba721a5"
        },
        {
          "path": "examples/play-prod-v2/properties/play/chnls_film_serie_params_genre.metis",
          "blob_oid": "261d65fc011bfecfeea4a4b90ef530735ef0cf8f"
        },
        {
          "path": "examples/play-prod-v2/properties/play/chnls_film_serie_top_viewed.metis",
          "blob_oid": "57926885f2e4a3733cf5fac6f5292a615e6415db"
        },
        {
          "path": "examples/play-prod-v2/properties/play/chnls_movie_most_recent_params_channel.metis",
          "blob_oid": "bbf1b511caab8a9defc7a46277f9a3715aebe12a"
        },
        {
          "path": "examples/play-prod-v2/properties/play/chnls_movie_top_viewed24_hparams_channel.metis",
          "blob_oid": "c011f689319e289cfcd18b7010d05dc1395afe33"
        },
        {
          "path": "examples/play-prod-v2/properties/play/chnls_serie_most_recent_params_channel.metis",
          "blob_oid": "a1cede9c3f0c7d8fe66ff90cd228e100e7e12dc0"
        },
        {
          "path": "examples/play-prod-v2/properties/play/chnls_serie_params_genre.metis",
          "blob_oid": "e3d513094897c7ea758c24ec90bfc879504f65e8"
        },
        {
          "path": "examples/play-prod-v2/properties/play/chnls_serie_top_viewed24_hparams_channel.metis",
          "blob_oid": "6e6612b6514aee440445612322957e90c752b5b1"
        },
        {
          "path": "examples/play-prod-v2/properties/play/chnls_stagioni_fep_most_recent_params_channel.metis",
          "blob_oid": "9caa54a539c5a263a7f9c3d32747697dfeaf18c7"
        },
        {
          "path": "examples/play-prod-v2/properties/play/clip24_hparams_season.metis",
          "blob_oid": "9fae98c359b5cd4bb5ef3b930b520431a22851de"
        },
        {
          "path": "examples/play-prod-v2/properties/play/collaborative_simili.metis",
          "blob_oid": "47b811311a5062f6fcfcd1ac21d0cc0ca2fc0db7"
        },
        {
          "path": "examples/play-prod-v2/properties/play/collection_order_by_editor.metis",
          "blob_oid": "51d0927d96deff76a4fcefcc054a1a2f2ab8bbd9"
        },
        {
          "path": "examples/play-prod-v2/properties/play/collection_params.metis",
          "blob_oid": "e3e6ea6d8be71344d6af7a7b62d6acfcd2949869"
        },
        {
          "path": "examples/play-prod-v2/properties/play/continua_a_guardare.metis",
          "blob_oid": "a5a970aa7b34d4d6c4b09dd549b086ad9edeab21"
        },
        {
          "path": "examples/play-prod-v2/properties/play/documentari_params_genre.metis",
          "blob_oid": "bb11e20a7c0439c337d4addfcba902e221dcb7ca"
        },
        {
          "path": "examples/play-prod-v2/properties/play/documentari_piu_visti24_h.metis",
          "blob_oid": "12d4e7f9f9ee80ae356c61873408660a918086c0"
        },
        {
          "path": "examples/play-prod-v2/properties/play/enabler_documentari.metis",
          "blob_oid": "c7f11732c66d84273184664bc2b333198f54f8a0"
        },
        {
          "path": "examples/play-prod-v2/properties/play/enabler_extra_anticipazioni.metis",
          "blob_oid": "4f50e1da1f8b9e383052528a497649cae4863e31"
        },
        {
          "path": "examples/play-prod-v2/properties/play/enabler_film_del_momento.metis",
          "blob_oid": "f9370fa106b6b718e7d3e0b682e4d7ae2ed6f51d"
        },
        {
          "path": "examples/play-prod-v2/properties/play/enabler_highlights_calcio.metis",
          "blob_oid": "67a0609649a8ea4e8f23449013c22b29bc1c3b28"
        },
        {
          "path": "examples/play-prod-v2/properties/play/enabler_highlights_calcio_r4.metis",
          "blob_oid": "6088240b9fb95d3565aac797fbaa391040137e4f"
        },
        {
          "path": "examples/play-prod-v2/properties/play/enabler_inf_film24_h.metis",
          "blob_oid": "74ece61de9603c766cbe0cb9344bed67a73b9014"
        },
        {
          "path": "examples/play-prod-v2/properties/play/enabler_play_cult.metis",
          "blob_oid": "690ef9eb2bc2ff88cb7aa6ed64fa2b8d683e3d0d"
        },
        {